Org Defined ID,Username,FirstName,LastName,Attempt #,Attempt Start,Attempt End,Section #,Q #,Q Type,Q Title,Q Text,Bonus?,Difficulty,Answer,Answer Match,Score,Out Of,Feedback
320,320,firstname320,lastname320,1,,,,6d,,,,,,"SELECT employee_nr, manager_nr FROM Employee WHERE manager_nr = `U000001`;",,,1,
321,321,firstname321,lastname321,1,,,,1e,,,,,,SELECT name From Artist where death_date is Null;,,,1,
321,321,firstname321,lastname321,1,,,,1f,,,,,,SELECT DISTINCT artist_id From Performs Where role = 'guitarist';,,,1,
321,321,firstname321,lastname321,1,,,,1g,,,,,,SELECT album_id FROM Release WHERE country = 'Belgium';,,,1,
321,321,firstname321,lastname321,1,,,,1h,,,,,,"SELECT T.song FROM Track T, Album A WHERE A.album_id = T.album_id AND A.title = 'Nevermind';",,,1,
321,321,firstname321,lastname321,1,,,,1i,,,,,,SELECT A.title FROM Album A WHERE not exists( Join Relaese R on R.album_id = A.album_id where R.country = 'Belgium' );,,,1,
321,321,firstname321,lastname321,1,,,,1j,,,,,,"SELECT A.title, SUM(T.duration) FROM Album A, Track T Where A.album_id = T.album_id GROUP BY T.album_id;",,,1,
321,321,firstname321,lastname321,1,,,,1k,,,,,,"SELECT A.name, COUNT(*) FROM Artist A, Performs P WHERE A.artist_id = P.artist_id AND P.role = 'vocals' group by A.artist_id HAVING COUNT(*) > 2 ORDER by COUNT(*) DESC;",,,1,
321,321,firstname321,lastname321,1,,,,6d,,,,,,idk man,,,1,
322,322,firstname322,lastname322,1,,,,1e,,,,,,SELECT name  FROM Artist WHERE death_date IS NULL;,,,1,
322,322,firstname322,lastname322,1,,,,1f,,,,,,SELECT artist_id FROM Performs WHERE EXISTS ( SELECT Performs2.artist_id  FROM Performs AS Performs2 WHERE Performs.artist_id = Performs2.artist_id AND Performs.role = 'guitarist');,,,1,
322,322,firstname322,lastname322,1,,,,1g,,,,,,SELECT album_id FROM Release WHERE country = 'Belgium';,,,1,
322,322,firstname322,lastname322,1,,,,1h,,,,,,"SELECT Track.song FROM Track, Album WHERE Track.album_id = Album.album_id AND Album.title = 'Nevermind';",,,1,
322,322,firstname322,lastname322,1,,,,1i,,,,,,"SELECT Album.title FROM Album, Release WHERE Album.album_id = Release.album_id AND Release.country <> 'Belgium';",,,1,
322,322,firstname322,lastname322,1,,,,1j,,,,,,"SELECT Album.title and SUM(Track.duration) FROM Album, Track WHERE Album.album_id = Track.album_id GROUP BY Album.title;",,,1,
322,322,firstname322,lastname322,1,,,,1k,,,,,,"SELECT Artist.name, COUNT(Performs.role) AS role_count FROM Artist, Performs WHERE role = 'vocals' GROUP BY Artist.name HAVING role_count >= 3 ORDER BY role_count DESC;",,,1,
322,322,firstname322,lastname322,1,,,,6d,,,,,,"WITH RECURSIVE manager_chain(employee_nr, manager_nr) AS  (     SELECT employee_nr     FROM Employee     WHERE employee_nr = 'U000001'     UNION     SELECT E.employee_nr     FROM manager_chain M, Employee E     WHERE E.manager_nr = M.employee_nr ) SELECT * manager_chain AS Employee;",,,1,
323,323,firstname323,lastname323,1,,,,1e,,,,,,SELECT name FROM Artist WHERE death_date IS NULL;,,,1,
323,323,firstname323,lastname323,1,,,,1f,,,,,,SELECT DISTINCT artist_id FROM Performs WHERE role='guitarist';,,,1,
323,323,firstname323,lastname323,1,,,,1g,,,,,,SELECT album_id FROM Release WHERE country='Belgium';,,,1,
323,323,firstname323,lastname323,1,,,,1h,,,,,,"SELECT T.song FROM Track T, Album A WHERE A.title='Nevermind' AND A.album_id=T.album_id; -- Songs as in the attribute song or as in tracks? It is unclear",,,1,
323,323,firstname323,lastname323,1,,,,1i,,,,,,SELECT A.title FROM Album A WHERE NOT EXISTS( SELECT * FROM Release R WHERE R.country='Belgium' AND R.album_id=A.album_id);,,,1,
323,323,firstname323,lastname323,1,,,,1j,,,,,,"SELECT A.title, SUM(T.duration) AS total_duration FROM Album A , Track T WHERE T.album_id=A.album_id GROUP BY A.title;   ",,,1,
323,323,firstname323,lastname323,1,,,,1k,,,,,," SELECT A.name , COUNT(*) AS numbers FROM Artist A, Performs P   WHERE A.artist_id = P.artist_id AND P.role='vocals'  GROUP BY A.name  HAVING COUNT(*)>=3  ORDER BY numbers DESC;",,,1,
323,323,firstname323,lastname323,1,,,,6d,,,,,,"WITH RECURSIVE Managed_by(employee_nr) AS ( SELECT employee_nr FROM Employee WHERE employee_nr = 'U000001' UNION  SELECT E.employee_nr FROM Employee E , Managed_by M WHERE M.employee_nr = E.manager_nr ) SELECT employee_nr FROM Managed_by;",,,1,
324,324,firstname324,lastname324,1,,,,1e,,,,,,SELECT name FROM Artist WHERE death_date IS NULL,,,1,
324,324,firstname324,lastname324,1,,,,1f,,,,,,SELECT artist_id FROM Artist  AND role FROM Perform  WHERE role IS 'guitarist' ,,,1,
324,324,firstname324,lastname324,1,,,,1g,,,,,,SELECT album_id FROM Albums  AND country FROM Release  WHERE country IS ´Belgium´,,,1,
324,324,firstname324,lastname324,1,,,,1h,,,,,,SELECT song FROM Track AND title FROM Album WHERE title IS 'Nevermind',,,1,
324,324,firstname324,lastname324,1,,,,1i,,,,,,SELECT title FROM Albums  AND country FROM Release WHERE country IS NOT ´Belgium´,,,1,
324,324,firstname324,lastname324,1,,,,1j,,,,,,SELECT title FROM Album  AND duration FROM Track WHERE total_duration = SUM(duration),,,1,
324,324,firstname324,lastname324,1,,,,1k,,,,,,SELECT name FROM Artist AND role FROM Performs  WHERE role IS 'vocals',,,1,
324,324,firstname324,lastname324,1,,,,6d,,,,,,WITH RECURSIVE,,,1,
325,325,firstname325,lastname325,1,,,,1e,,,,,,SELECT name FROM Artist A WHERE A.death_date IS NULL;,,,1,
325,325,firstname325,lastname325,1,,,,1f,,,,,,SELECT DISTINCT artist_id FROM Performs P WHERE P.role = 'guitarist';,,,1,
325,325,firstname325,lastname325,1,,,,1g,,,,,,SELECT album_id FROM Release R WHERE R.country = 'Belgium';,,,1,
325,325,firstname325,lastname325,1,,,,1h,,,,,,"SELECT song FROM Track T, Album A WHERE T.album_id = A.album_id AND A.title = 'Nevermind';",,,1,
325,325,firstname325,lastname325,1,,,,1i,,,,,,"SELECT title FROM Album A, Release R WHERE A.album_id = R.album_id  AND NOT IN (     SELECT country     FROM Release R     WHERE R.country = 'Belgium'     );     ",,,1,
325,325,firstname325,lastname325,1,,,,1j,,,,,,"SELECT title, SUM(duration) AS total_duration FROM Album A, Track T WHERE A.album_id = T.album_id GROUP BY title;",,,1,
325,325,firstname325,lastname325,1,,,,1k,,,,,,"SELECT name, COUNT(*) AS nr_of_tracks_vocal FROM Artist A, Performs P WHERE A.artist_id = P.artist_id AND P.role = 'vocals' AND COUNT(*) >= 3 ORDER BY COUNT(*) DESC",,,1,
325,325,firstname325,lastname325,1,,,,6d,,,,,,"WITH RECURSIVE employees_managed(employee_nr) ( SELECT E.manager_id AS employee_nr FROM Employee E WHERE E.employee_nr = 'U000001' UNION SELECT E.manager_id AS E.employee_nr FROM employees_managed M, Employee E WHERE E.manager_id = E.employee_nr AND NOT E.manager_id IS NOT ) SELECT * FROM employees_managed;",,,1,
326,326,firstname326,lastname326,1,,,,1e,,,,,,SELECT Artist.name FROM Artist WHERE Artist.death_date IS NULL;,,,1,
326,326,firstname326,lastname326,1,,,,1f,,,,,,"SELECT DISTINCT Artist.artist_id FROM Artist, Performs WHERE Artist.artist_id = Performs.artist_id  .  ; ",,,1,
326,326,firstname326,lastname326,1,,,,1g,,,,,,"SELECT DISTINCT Album.album_id FROM Album, Release WHERE Album.album_id = Release.album_id AND Release.  ; ",,,1,
326,326,firstname326,lastname326,1,,,,1h,,,,,,"SELECT Track.song FROM Track, Album WHERE Track.album_id = Album.album_id AND Album.title = 'Nevermind';",,,1,
326,326,firstname326,lastname326,1,,,,1i,,,,,,"SELECT DISTINCT Album.title FROM Album, Release WHERE Album.album_id = Release.album_id AND Release.  ;",,,1,
326,326,firstname326,lastname326,1,,,,1j,,,,,,"SELECT Album.title, COUNT(Track.duration) AS total_duration FROM Album, Track WHERE Album.album_id  .   .;",,,1,
326,326,firstname326,lastname326,1,,,,1k,,,,,,"SELECT Artist.name, COUNT(*) AS vocal_performances FROM Artist, Performs WHERE Artist.artist_id = .  .    .  *      ; ",,,1,
326,326,firstname326,lastname326,1,,,,6d,,,,,,"WITH RECURSIVE ManagerEmployees(manager_nr, employee_nr) AS (SELECT manager_nr, employee_nr FROM    ., .   ,    .  .  .   ,  ,    .  .  .  .  .  ; ",,,1,
327,327,firstname327,lastname327,1,,,,1e,,,,,,SELECT name FROM Artist WHERE death_date IS NOT NULL;,,,1,
327,327,firstname327,lastname327,1,,,,1f,,,,,,SELECT artist_id FROM Performs WHERE  role = 'guitarist';,,,1,
327,327,firstname327,lastname327,1,,,,1g,,,,,,SELECT album_id FROM Release WHERE country = 'Belgium';,,,1,
327,327,firstname327,lastname327,1,,,,1h,,,,,,"SELECT song FROM Track T, Album A WHERE T.album_id = A.album_id AND A.title = 'Nevermind';",,,1,
327,327,firstname327,lastname327,1,,,,1i,,,,,,"SELECT DISTINCT A.title FROM Album A, Release R WHERE R.country <> 'Belgium' AND R.album_id = A.album_id;",,,1,
327,327,firstname327,lastname327,1,,,,1j,,,,,,"SELECT Album.title COUNT(Track.duration) FROM Track T, Album A WHERE A.album_id = T.album_id;",,,1,
327,327,firstname327,lastname327,1,,,,1k,,,,,,"SELECT Artist.name, COUNT(Track.track_id) FROM Artist A, Track T, Performs P WHERE T.song >= 3 AND P.role = 'vocals' DESC;",,,1,
327,327,firstname327,lastname327,1,,,,6d,,,,,,-,,,1,
328,328,firstname328,lastname328,1,,,,1e,,,,,,SELECT name FROM Artist WHERE death_date IS NULL;,,,1,
328,328,firstname328,lastname328,1,,,,1f,,,,,,SELECT DISTINCT artist_id FROM Performs WHERE role = 'guitarist';,,,1,
328,328,firstname328,lastname328,1,,,,1g,,,,,,SELECT album_id FROM Release WHERE country = 'Belgium';,,,1,
328,328,firstname328,lastname328,1,,,,1h,,,,,,"SELECT T.song FROM Track T, Album A WHERE T.album_id = A.album_id AND A.title = 'Nevermind';",,,1,
328,328,firstname328,lastname328,1,,,,1i,,,,,,"SELECT DISTINCT A.title FROM Album A, Release R WHERE A.album_id = R.album_id AND NOT EXISTS ( SELECT *     .  .    ;",,,1,
328,328,firstname328,lastname328,1,,,,1j,,,,,,"SELECT A.title, SUM(T.duration) FROM Track T, Album A WHERE T.album_id = A.album_id GROUP BY A.title;",,,1,
328,328,firstname328,lastname328,1,,,,1k,,,,,,"SELECT A.name, COUNT(P.*) AS tracks FROM Artist A, Performs P WHERE A.artist_id = P.artist_id AND .    .*     ;",,,1,
328,328,firstname328,lastname328,1,,,,6d,,,,,,"WITH RECURSIVE Worksfor (id) AS ( ( SELECT X.employee_nr AS id FROM Employee X WHERE X.employee_nr      .     ,    .  .  .       *  ;",,,1,
329,329,firstname329,lastname329,1,,,,1e,,,,,,SELECT name FROM Artist WHERE death_date IS NOT NULL;,,,1,
329,329,firstname329,lastname329,1,,,,1f,,,,,,SELECT DISTINCT artist_id FROM Performs WHERE role='guitarist';,,,1,
329,329,firstname329,lastname329,1,,,,1g,,,,,,SELECT album_id FROM Release WHERE country='Belgium';,,,1,
329,329,firstname329,lastname329,1,,,,1h,,,,,,SELECT song FROM Track T JOIN Album A ON T.album_id=A.album_id WHERE A.title='Nevermind';,,,1,
329,329,firstname329,lastname329,1,,,,1i,,,,,,SELECT DISTINCT title FROM Album A JOIN Release R ON A.album_id=R.album_id WHERE NOT country='Belgium';,,,1,
329,329,firstname329,lastname329,1,,,,1j,,,,,,"SELECT A.title, SUM(T.duration) FROM Track T JOIN Album A ON T.album_id=A.album_id GROUP BY album_id;",,,1,
329,329,firstname329,lastname329,1,,,,1k,,,,,,"SELECT name, COUNT(*) FROM Artist A JOIN Performs P ON  A.artist_id=P.artist_id WHERE P.role='vocals' GROUP BY artist_id HAVING COUNT(*)>2",,,1,
329,329,firstname329,lastname329,1,,,,6d,,,,,,"WITH RECURSIVE get_employees(employee_nr, manager_nr) AS (     SELECT employee_nr, manager_nr FROM Employee WHERE employee_nr='U000001' UNION SELECT      E.employee_nr, E.manager_nr FROM get_employees g, Employee E      WHERE g.employee_nr=E.manager_nr)  SELECT employee_nr FROM get_employees AS employees;",,,1,
330,330,firstname330,lastname330,1,,,,1e,,,,,,SELECT name FROM Artist WHERE death_date IS NULL;,,,1,
330,330,firstname330,lastname330,1,,,,1f,,,,,,"SELECT DISTINCT A.artist_id FROM Artist A, Performs P WHERE A.artist_id=P.artist_id AND P.role='guitarist';",,,1,
330,330,firstname330,lastname330,1,,,,1g,,,,,,SELECT album_id FROM Release WHERE country='Belgium';,,,1,
330,330,firstname330,lastname330,1,,,,1h,,,,,,"SELECT T.song FROM Track T, Album A WHERE T.album_id = A.album_id AND A.title = 'Nevermind';",,,1,
330,330,firstname330,lastname330,1,,,,1i,,,,,,"SELECT DISTINCT A.title FROM Album A, Release R WHERE A.album_id = R.album_id AND NOT EXISTS(SELECT       ;",,,1,
330,330,firstname330,lastname330,1,,,,1j,,,,,,"SELECT A.title, SUM(T.duration) FROM Album A, Track T WHERE A.album_id=T.album_id GROUP BY A.title;",,,1,
330,330,firstname330,lastname330,1,,,,1k,,,,,,"SELECT A.name, COUNT(*) FROM Artist A, Performs P WHERE A.artist_id = P.artist_id AND P.role = 'vocals'   .  *;",,,1,
330,330,firstname330,lastname330,1,,,,6d,,,,,,"WITH RECURSIVE managed(id) AS(SELECT employee_nr AS id FROM Employee WHERE employee_nr = 'U000001'        ,    .  .   .    *  ;",,,1,
331,331,firstname331,lastname331,1,,,,1e,,,,,,SELECT name FROM Artist WHERE death_date IS NULL;,,,1,
331,331,firstname331,lastname331,1,,,,1f,,,,,,SELECT DISTINCT artist_id FROM Performs WHERE role = ´guitarist´;,,,1,
331,331,firstname331,lastname331,1,,,,1g,,,,,,SELECT album_id FROM Release WHERE country = ´Belgium´;,,,1,
331,331,firstname331,lastname331,1,,,,1h,,,,,,"SELECT song FROM Track, Album WHERE Track.album_id = Album.album_id AND title = ´Nevermind´;",,,1,
331,331,firstname331,lastname331,1,,,,1i,,,,,,SELECT titile FROM Album WHERE album_id NOT IN (     SELECT album_id     FROM Release     WHERE country = ´Belgium´ );,,,1,
331,331,firstname331,lastname331,1,,,,1j,,,,,,"SELECT title, SUM(duration) FROM Track, Album WHERE Track.album_id = Album.album_id GROUP BY title;",,,1,
331,331,firstname331,lastname331,1,,,,1k,,,,,,"SELECT name, COUNT(*) FROM Artist, Performs WHERE Artist.artist_id = Performs.artist_id AND role = ´vocals´ GROUP BY name HAVING COUNT(*) >= 3  ORDER BY COUNT(*) DESC;",,,1,
331,331,firstname331,lastname331,1,,,,6d,,,,,,"WITH RECURSIVE ManagedByU000001(employee_nr) AS (     SELECT E.employee_nr     FROM Employee E     WHERE E.employee_nr = ´U000001´ UNION      SELECT E.employee_nr     FROM Employee E, ManagedByU000001 M     WHERE E.manager_nr = M.employee_nr ) SELECT * FROM ManagedByU000001;",,,1,
332,332,firstname332,lastname332,1,,,,1e,,,,,,SELECT name FROM Artist WHERE death_date NOT IS NULL,,,1,
332,332,firstname332,lastname332,1,,,,1f,,,,,,CREATE VIEW artist_id AS     SELECT *     FROM Performs     WHERE role = 'guitarist',,,1,
332,332,firstname332,lastname332,1,,,,1g,,,,,,CREATE VIEW album_id AS     SELECT *     FROM Release     WHERE country = 'Belgium',,,1,
332,332,firstname332,lastname332,1,,,,1h,,,,,,SELECT song FROM Track WHERE Album.title = 'Nevermind',,,1,
332,332,firstname332,lastname332,1,,,,1i,,,,,,CREATE VIEW album_id AS     SELECT *     FROM Album     WHERE title NOT IS 'Belgium',,,1,
332,332,firstname332,lastname332,1,,,,1j,,,,,,"SELECT A.title, T.duration FROM Album A, Track T",,,1,
332,332,firstname332,lastname332,1,,,,1k,,,,,,"SELECT A.name, COUNT(A.role = 'vocal')  FROM Artist A WHERE COUNT(A.role = 'vocals') >= 3",,,1,
332,332,firstname332,lastname332,1,,,,6d,,,,,,,,,1,
333,333,firstname333,lastname333,1,,,,1e,,,,,,SELECT name FROM Artist WHERE death_date IS NULL;,,,1,
333,333,firstname333,lastname333,1,,,,1f,,,,,,SELECT DISTINCT artist_id FROM Performs WHERE role='guitarist';,,,1,
333,333,firstname333,lastname333,1,,,,1g,,,,,,SELECT album_id FROM Release WHERE country='Belgium';,,,1,
333,333,firstname333,lastname333,1,,,,1h,,,,,,"SELECT song FROM Album,Track WHERE Album.album_id = Track.album_id AND title ='Nevermind';",,,1,
333,333,firstname333,lastname333,1,,,,1i,,,,,,SELECT title FROM Album WHERE NOT EXISTS(SELECT * FROM Release WHERE Album.album_id = Release.album_id AND country='Belgium');,,,1,
333,333,firstname333,lastname333,1,,,,1j,,,,,,"SELECT title,SUM(duration) FROM Album,Track WHERE Album.album_id = Track.album_id GROUP BY title;",,,1,
333,333,firstname333,lastname333,1,,,,1k,,,,,,"SELECT name,COUNT(*) AS number FROM Artist, Track, Performs WHERE Artist.artist_id = Performs.artist_id AND Performs.track_id = Track.track_id  AND role= 'vocals' GROUP BY name HAVING COUNT(*) >= 3 ORDER BY number DESC;",,,1,
333,333,firstname333,lastname333,1,,,,6d,,,,,,"WITH RECURSIVE Ancestor(employee_nr,manager_nr) AS ( SELECT employee_nr,manager_nr FROM Employee UNION SELECT E.manager_nr, A.employee_nr FROM Employee E, Ancestor A WHERE E.employee_nr = A.manager_nr ) SELECT A.employee_nr FROM Employee E, Ancestor A WHERE A.manager_nr = 'U000001' UNION SELECT employee_nr FROM Employee WHERE employee_nr = 'U000001';",,,1,
334,334,firstname334,lastname334,1,,,,1e,,,,,,SELECT name FROM Artist WHERE death_date IS NOT NULL;,,,1,
334,334,firstname334,lastname334,1,,,,1f,,,,,,SELECT DISTINCT artist_id  FROM Performs WHERE role = ´guitarist´;,,,1,
334,334,firstname334,lastname334,1,,,,1g,,,,,,SELECT album_id FROM Release WHERE country = ´Belgium´;,,,1,
334,334,firstname334,lastname334,1,,,,1h,,,,,,"SELECT song FROM Album A, Track T WHERE A.album_id = T.album_id AND title = ´Nevermind´;",,,1,
334,334,firstname334,lastname334,1,,,,1i,,,,,,SELECT title FROM Album A WHERE NOT EXISTS(     SElECT *     FROM Release R     WHERE R.album_id = A.album_id     AND country = ´Belgium´     );,,,1,
334,334,firstname334,lastname334,1,,,,1j,,,,,,"SELECT title, SUM(duration) FROM Album A, Track T WHERE A.album_id = T.album_id GROUP BY album_id;",,,1,
334,334,firstname334,lastname334,1,,,,1k,,,,,,"SELECT name, COUNT(role) FROM Artist A, Performs P WHERE A.artist_id = p.artist_id AND role = ´vocals´ GROUP BY role HAVING COUNT(role) > 2 ORDER BY COUNT(role);",,,1,
334,334,firstname334,lastname334,1,,,,6d,,,,,,"WITH RECURSION maneged(employee_nr) AS( SELECT employee_nr FROM Employee E WHERE E.employee_nr = 'U000001' UNION SELECT E.manager_nr AS employee_nr FROM maneged M, Employee E WHERE M.employee_nr = E.employee_nr AND NOT E.manager_nr IS NULL ) SELECT * FROM managed;",,,1,
335,335,firstname335,lastname335,1,,,,1e,,,,,,SELECT name FROM Artist WHERE death_date IS NULL;,,,1,
335,335,firstname335,lastname335,1,,,,1f,,,,,,"SELECT artist_id FROM Artist, Performs WHERE Artist.artist_id = Performs.artist_id AND Performs.role = 'guitarist';",,,1,
335,335,firstname335,lastname335,1,,,,1g,,,,,,"SELECT album_id FROM Album, Release WHERE Album.album_id = Release.album_id AND Release.country = 'Belgium';",,,1,
335,335,firstname335,lastname335,1,,,,1h,,,,,,"SELECT DISTINCT song  FROM Album, Track WHERE Album.album_id = Track.album_id AND Album.title = 'Nevermind';",,,1,
335,335,firstname335,lastname335,1,,,,1i,,,,,,SELECT title FROM Album WHERE NOT 'Belgium' IN ( SELECT country FROM Release WHERE Release.album_id = Album.album_id );,,,1,
335,335,firstname335,lastname335,1,,,,1j,,,,,,"SELECT title, SUM(duration) AS total FROM Album, Track WHERE Album.album_id = Track.album_id GROUP BY title;    ",,,1,
335,335,firstname335,lastname335,1,,,,1k,,,,,,"SELECT name, COUNT(*) AS total FROM Artist, Performs WHERE Artist.artist_id = Performs.artist_id AND Performs.role = 'vocals' GROUP BY name HAVING total >= 3 ORDER BY total DESC;",,,1,
335,335,firstname335,lastname335,1,,,,6d,,,,,,"WITH RECURSIVE Funct(employee_nr) AS ( SELECT 'U000001' UNION SELECT employee_nr FROM Employee WHERE manager_nr = 'U000001' UNION SELECT employee_nr FROM Employee E, Funct F WHERE E.manager = F.employee_nr; ) SELECT * FROM Funct;",,,1,
336,336,firstname336,lastname336,1,,,,1e,,,,,,SELECT name FROM Artist WHERE death_date IS NULL;,,,1,
336,336,firstname336,lastname336,1,,,,1f,,,,,,SELECT DISTINCT artist_id FROM Performs WHERE role = 'guitarist';,,,1,
336,336,firstname336,lastname336,1,,,,1g,,,,,,"SELECT Album.album_id FROM Album, Release WHERE Album.album_id = Release.album_id AND Release.country  ;",,,1,
336,336,firstname336,lastname336,1,,,,1h,,,,,,"SELECT Track.song FROM Track, Album WHERE Album.album_id = Track.album_id And Album.title = 'Nevermind';",,,1,
336,336,firstname336,lastname336,1,,,,1i,,,,,,"SELECT Album.title FROM Album, Release WHERE Album.album_id = Release.album_id AND Album.album_id          ;",,,1,
336,336,firstname336,lastname336,1,,,,1j,,,,,,"SELECT Album.title, SUM(Track.duration) FROM Album, Track WHERE Track.album_id = Album.album_id GROUP  .;",,,1,
336,336,firstname336,lastname336,1,,,,1k,,,,,,"SELECT Artist.name, SUM(*) FROM Artist, Performs WHERE Performs.artist_id = Artist.artist_id GROUP BY Artist.artist_id HAVING SUM(*) >= 3 ORDER BY SUM(*) DESC",,,1,
336,336,firstname336,lastname336,1,,,,6d,,,,,,"WITH RECURSIVE Manager_Chain(employee_nr) AS ( SELECT employee_nr FROM Employee WHERE employee_nr = 'U000001' UNION SELECT E.employee_nr FROM Manager_Chain M, Employee E WHERE E.manager_nr = M.employee_nr ) SELECT * FROM Manager_chain;",,,1,
337,337,firstname337,lastname337,1,,,,1e,,,,,,SELECT DISTINCT Artist.name FROM Artist WHERE Artist.death_date IS NULL;,,,1,
337,337,firstname337,lastname337,1,,,,1f,,,,,,SELECT DISTINCT Performs.artist_id FROM Performs WHERE role = 'guitarist';,,,1,
337,337,firstname337,lastname337,1,,,,1g,,,,,,SELECT Release.album_id FROM Release WHERE Release.country = 'Belgium';,,,1,
337,337,firstname337,lastname337,1,,,,1h,,,,,,"SELECT Track.song FROM Track, Album WHERE Track.album_id = Album.album_id AND Album.title = 'Nevermind';",,,1,
337,337,firstname337,lastname337,1,,,,1i,,,,,,"SELECT Album.title FROM Album, Release WHERE Album.album_id = Release.album_id AND Release.album_id NOT IN (     SELECT Release.album_id     FROM Release     WHERE Release.country = 'Belgium' );",,,1,
337,337,firstname337,lastname337,1,,,,1j,,,,,,"SELECT Album.title, SUM(Track.duration) FROM Album, Track WHERE Album.album_id = Track.album_id GROUP BY Album.title HAVING SUM(Track.duration);",,,1,
337,337,firstname337,lastname337,1,,,,1k,,,,,,"SELECT Artist.name, COUNT(Performs.role) FROM Artist, Performs WHERE Artist.artist_id = Performs.artist_id AND Performs.role = artist ORDER BY COUNT(Performs.role) DESC GROUP BY Artist.name HAVING COUNT(Performs.role) > 2;",,,1,
337,337,firstname337,lastname337,1,,,,6d,,,,,,"WITH RECURSIVE manager (employee_nr, manager_nr) AS (     SELECT employee_nr, manager_nr     FROM Employee     UNION     SELECT manager.employee_nr, Employee.manager_nr     FROM Employee, manager     WHERE manager.manager_nr = Employee.employee_nr ) SELECT manager.employee_nr FROM manager WHERE manager.manager_nr = 'U000001' OR manager.employee_nr = 'U000001';",,,1,
338,338,firstname338,lastname338,1,,,,1e,,,,,,SELECT name FROM Artist WHERE death_date < '2025-01-15',,,1,
338,338,firstname338,lastname338,1,,,,1f,,,,,,SELECT DISTINCT artist_id FROM Perfomrs WHERE role = 'guitarist',,,1,
338,338,firstname338,lastname338,1,,,,1g,,,,,,SELECT album_id FROM Release WHERE country = 'Belgium',,,1,
338,338,firstname338,lastname338,1,,,,1h,,,,,,"SELECT Track.song FROM Track,Album WHERE Track.album_id = Album.album_id AND Album.title = 'Nevermind'",,,1,
338,338,firstname338,lastname338,1,,,,1i,,,,,,"SELECT Album.title FROM Album,Release WHERE Album.album_id = Release.album_id AND NOT Release.country = 'Belgium'",,,1,
338,338,firstname338,lastname338,1,,,,1j,,,,,,"SELECT Album.title, SUM(Track.duration) FROM Album,Track WHERE Track.album_id = Album.album_id",,,1,
338,338,firstname338,lastname338,1,,,,1k,,,,,,"SELECT Artist.name, COUNT(*) FROM Artist,Release WHERE Artist.artist_id = Releas.artist_id AND HAVING COUNT >= 3 DESC",,,1,
338,338,firstname338,lastname338,1,,,,6d,,,,,,?,,,1,
339,339,firstname339,lastname339,1,,,,1e,,,,,,SELECT name FROM Artist WHERE death_date IS NULL;,,,1,
339,339,firstname339,lastname339,1,,,,1f,,,,,,SELECT DISTINCT artist_id FROM Performs WHERE role = 'guitarist';,,,1,
339,339,firstname339,lastname339,1,,,,1g,,,,,,SELECT album_id FROM Release WHERE country = 'Belgium';,,,1,
339,339,firstname339,lastname339,1,,,,1h,,,,,,"SELECT Track.song FROM Track, Album WHERE Track.album_id = Album.album_id AND Album.title = 'Nevermind';",,,1,
339,339,firstname339,lastname339,1,,,,1i,,,,,,SELECT DISTINCT Album.title FROM Album WHERE NOT EXISTS(     SELECT *     FROM Release     WHERE Album.album_id = Release.album_id     AND Release.country = 'Belgium');,,,1,
339,339,firstname339,lastname339,1,,,,1j,,,,,,"SELECT Album.title, SUM(Track.duration) FROM Album, Track WHERE Album.album_id = Track.album_id;",,,1,
339,339,firstname339,lastname339,1,,,,1k,,,,,,"SELECT Artist.name, COUNT(Performs.artist_id) AS perform_count FROM Artist, Performs WHERE Performs.role = 'vocals' AND perform_count >= 3 GROUP ON Artist.name ORDER BY perform_count DESC;",,,1,
339,339,firstname339,lastname339,1,,,,6d,,,,,,"WITH RECURSIVE Managed(manager_nr, employee_nr) AS (     SELECT manager_nr, employee_nr     FROM Employee     UNION     SELECT E.manager_nr, M.employee_nr     FROM Employee E, Managed M     WHERE E.employee_nr = M.manager_nr) SELECT E2.employee_nr FROM Employee E1, Employee E2, Managed M WHERE E1.employee_nr = M.manager_nr AND E2.employee_nr = M.employee_nr AND E1.employee nr = 'U000001';",,,1,
340,340,firstname340,lastname340,1,,,,1e,,,,,,SELECT name FROM Artist WHERE death_date IS NULL;,,,1,
340,340,firstname340,lastname340,1,,,,1f,,,,,,"SELECT DISTINCT A.artist_id FROM Artist A, Track T, Performs F WHERE A.artist_id = T.artist_id  AND T.track_id = P.track_id  AND P.role = ´guitarist´;",,,1,
340,340,firstname340,lastname340,1,,,,1g,,,,,,SELECT album_id FROM Release WHERE country = ´Belgium´;,,,1,
340,340,firstname340,lastname340,1,,,,1h,,,,,,"SELECT T.song  FROM Track T, Album A WHERE T.album_id = A.album_id AND A.title = ´Nevermind´;",,,1,
340,340,firstname340,lastname340,1,,,,1i,,,,,,"SELECT A.title FROM Album A, Release R WHERE A.album_id = R.album_id AND R.country IS NOT ´Belgium´;",,,1,
340,340,firstname340,lastname340,1,,,,1j,,,,,,"SELECT A.title, sum(T.duration) FROM Album A, Track T WHERE A.album_id = T.album_id",,,1,
340,340,firstname340,lastname340,1,,,,1k,,,,,,"SELECT A.name, COUNT(*) AS total_vocals  FROM Artist A, Performs P WHERE A.artist_id = P.artist_id AND P.role = ´vocals´ HAVING COUNT(*) >= 3 ORDER BY total_vocals DESC;",,,1,
