Org Defined ID,Username,FirstName,LastName,Attempt #,Attempt Start,Attempt End,Section #,Q #,Q Type,Q Title,Q Text,Bonus?,Difficulty,Answer,Answer Match,Score,Out Of,Feedback
455,455,firstname455,lastname455,1,,,,6d,,,,,,"WITH RECURSIVE Management_chain (employee_nr, manager_nr) AS ( SELECT employee_nr FROM Employee WHERE manager_nr = 'U000001' UNION SELECT Employee.employee_nr FROM Mangement_chain, Employee WHERE Management_chain.employee_nr = Employee.manager_nr ) SELECT * FROM Management_chain;",,,1,
456,456,firstname456,lastname456,1,,,,1e,,,,,,SELECT name FROM Artist A WHERE death_date <> NULL,,,1,
456,456,firstname456,lastname456,1,,,,1f,,,,,,"SELECT DISTINCT A.artist_id FROM Artist A, Performs P WHERE A.artist_id = P.artist_id AND P.role = guitarist",,,1,
456,456,firstname456,lastname456,1,,,,1g,,,,,,SELECT A.album_id FROM Album A WHERE NOT E,,,1,
456,456,firstname456,lastname456,1,,,,1h,,,,,,SELECT song FROM Track Where album_id = 'Nevermind',,,1,
456,456,firstname456,lastname456,1,,,,1i,,,,,,,,,1,
456,456,firstname456,lastname456,1,,,,1j,,,,,,,,,1,
456,456,firstname456,lastname456,1,,,,1k,,,,,,"SELECT A.artist, Count(*) as number from Artist A, Performs P Where P.role = 'vocals' =>3",,,1,
456,456,firstname456,lastname456,1,,,,6d,,,,,,"WITH RECURSIVE Employee_chain(employee_nr, manager_nr) AS ( SELECT employee_nr, manager_nr FROM Employee WHERE employee_nr = 'U000001' UNION SELECT (B.employee_nr, B.manager_nr) FROM Employee_chain A, Employee B wHERE A.employee_nr = B.manager_nr ) SELECT * FROM Employee_chain AS Employee;",,,1,
457,457,firstname457,lastname457,1,,,,1e,,,,,,SELECT name FROM Artist WHERE Artist.death_date IS NULL;,,,1,
457,457,firstname457,lastname457,1,,,,1f,,,,,,SELECT DISTINCT artist_id FROM Performs WHERE Performs.role = 'guitarist';,,,1,
457,457,firstname457,lastname457,1,,,,1g,,,,,,SELECT album_id FROM Release WHERE Release.country = 'Belgium';,,,1,
457,457,firstname457,lastname457,1,,,,1h,,,,,,"SELECT DISTINCT song FROM Track, Album WHERE Track.album_id = Album.album_id AND Album.title = 'Nevermind';",,,1,
457,457,firstname457,lastname457,1,,,,1i,,,,,,SELECT title FROM Album WHERE NOT EXISTS(     SELECT *     FROM Release     WHERE Release.album_id = Album.album_id     AND Release.country = 'Belgium');,,,1,
457,457,firstname457,lastname457,1,,,,1j,,,,,,"SELECT DISTINCT title, SUM(duration) FROM Album, Track WHERE Album.album_id = Track.album_id GROUP BY album_id;     ",,,1,
457,457,firstname457,lastname457,1,,,,1k,,,,,,"SELECT name, COUNT(track_id) FROM Artist, Performs WHERE Artist.artist_id = Performs.artist_id AND Performs.role = 'vocals' GROUP BY artist_id HAVING COUNT(track_id) > 2 ORDER BY COUNT(track_id) DESC;",,,1,
457,457,firstname457,lastname457,1,,,,6d,,,,,,,,,1,
458,458,firstname458,lastname458,1,,,,1e,,,,,,SELECT name FROM Artist WHERE death_date IS NULL;,,,1,
458,458,firstname458,lastname458,1,,,,1f,,,,,,SELECT DISTINCT artist_id FROM Performs WHERE role = 'guitarist'; --DISTINCT necessary as artist can be guitarist for multiple tracks.,,,1,
458,458,firstname458,lastname458,1,,,,1g,,,,,,SELECT album_id FROM Release WHERE country = 'Belgium'; -- DISTINCT not necessary as composite key over album_id and country,,,1,
458,458,firstname458,lastname458,1,,,,1h,,,,,,"SELECT T.song  FROM Track T, Album A WHERE T.album_id = A.album_id AND A.title = 'Nevermind';",,,1,
458,458,firstname458,lastname458,1,,,,1i,,,,,,SELECT title FROM Album WHERE album_id IN (     SELECT album_id     FROM Release     WHERE country IS NOT 'Belgium' );,,,1,
458,458,firstname458,lastname458,1,,,,1j,,,,,,"SELECT A.title, SUM(T.duration) as duration FROM Album A, Track T WHERE T.album_id = A.album_id GROUP BY A.album_id;",,,1,
458,458,firstname458,lastname458,1,,,,1k,,,,,,"SELECT A.name, COUNT(*)  FROM Artist A, Performs P WHERE A.artist_id = P.artist_id AND P.role = 'vocals' GROUP BY P.artist_id HAVING COUNT(*) >= 3 ORDER BY COUNT(*) DESC;",,,1,
458,458,firstname458,lastname458,1,,,,6d,,,,,,"WITH RECURSIVE Manager_employees(employee_nr) AS (     SELECT employee_nr     FROM Employee     WHERE employee_nr = 'U000001'     UNION     SELECT E.employee_nr     FROM Manager_employees M, Employee E     WHERE M.employee_nr = E.manager_nr ) SELECT * FROM Manager_employees;",,,1,
459,459,firstname459,lastname459,1,,,,1e,,,,,,SELECT name FROM Artist WHERE death_date != NULL,,,1,
459,459,firstname459,lastname459,1,,,,1f,,,,,,SELECT artist_id FROM Performs WHERE role=´guitarist´,,,1,
459,459,firstname459,lastname459,1,,,,1g,,,,,,SELECT album_id FROM Release WHERE Release.country=´Belgium´,,,1,
459,459,firstname459,lastname459,1,,,,1h,,,,,,"SELECT song FROM Track, Album WHERE Track.album_id = Album.album_id AND Album.title = ´Nevermind´",,,1,
459,459,firstname459,lastname459,1,,,,1i,,,,,,"SELECT DISTINCT title FROM Release, Album WHERE NOT Release.country=´Belgium´ AND Album.album_id = Release.album_id",,,1,
459,459,firstname459,lastname459,1,,,,1j,,,,,,"SELECT Album.title, sum(duration) FROM Album,Track WHERE Album.Album_id = Track.album_id GROUP BY title, sum(duration)",,,1,
459,459,firstname459,lastname459,1,,,,1k,,,,,,"SELECT Artist.name, count(role) FROM Artist, Track, Performs WHERE Artist.artist_id = Performs.artist_id AND Performs.album_id = Track.album_id AND Performs.role=´Vocals´ GROUP BY Artist.name, count(role) HAVING count(role) >= 3",,,1,
459,459,firstname459,lastname459,1,,,,6d,,,,,,"WITH managed(manager_id) AS( SELECT Employee.employee_nr FROM Employee WHERE Employee.manager_nr =´U000001´ UNION SELECT Employee.employee_nr FROM Employee, managed WHERE managed.manager_nr = Employee.manager_nr  )",,,1,
460,460,firstname460,lastname460,1,,,,1e,,,,,,SELECT name  FROM Artist WHERE death_date IS NULL,,,1,
460,460,firstname460,lastname460,1,,,,1f,,,,,,SELECT DISTINCT A.artist_id FROM Artists A NATURAL JOIN Performs P NATURAL JOIN Track WHERE P.role = ´guitarist´,,,1,
460,460,firstname460,lastname460,1,,,,1g,,,,,,SELECT Album.album_id FROM Album NATURAL JOIN Release  WHERE Release.country = ´Belgium´,,,1,
460,460,firstname460,lastname460,1,,,,1h,,,,,,"SELECT * FROM Track T, Album A, WHERE T.album_id = A.album_id  AND A.title = ´Nevermind´",,,1,
460,460,firstname460,lastname460,1,,,,1i,,,,,,SELECT A.title FROM Album A WHERE NOT EXISTS(SELECT country     FROM Release R     WHERE A.album_id = R.album_id     AND R.country = ´Belgium´),,,1,
460,460,firstname460,lastname460,1,,,,1j,,,,,,"SELECT Album.title, COUNT(*) AS total_duration FROM Album, Track WHERE Album.album_id = Track.album_id GROUP BY Album.title ORDER BY total_duration DESC",,,1,
460,460,firstname460,lastname460,1,,,,1k,,,,,,"SELECT Artist.name, COUNT(*) AS total_vocals FROM Artist, Performs WHERE Artist.artist_id = Performs.artist_id AND Performs.role = ´vocals´ GROUP BY Artist.name HAVING total_vocals >= 3",,,1,
460,460,firstname460,lastname460,1,,,,6d,,,,,,"WITH RECURSIVE employees_managed(employee_nr,manager_nr) AS (  SELECT employee_nr, manager_nr  FROM Employee  WHERE manager_nr = ´U000001´ UNION  SELECT employee_nr, manager_nr  FROM Employee  WHERE employee_nr = manager_nr ) SELECT employee_nr FROM Employee;",,,1,
461,461,firstname461,lastname461,1,,,,1e,,,,,,SELECT name FROM Artist  WHERE Artist.death_date IS NULL;,,,1,
461,461,firstname461,lastname461,1,,,,1f,,,,,,SELECT DISTINCT artist_id  FROM Performs WHERE Performs.role = 'guitarist';,,,1,
461,461,firstname461,lastname461,1,,,,1g,,,,,,SELECT DISTINCT album_id FROM Release WHERE Release.country = ´Belgium´;,,,1,
461,461,firstname461,lastname461,1,,,,1h,,,,,,SELECT * FROM Album WHERE Album.title = 'Nevermind';,,,1,
461,461,firstname461,lastname461,1,,,,1i,,,,,,SELECT Album.title FROM Album JOIN Release.album_id ON Album.album_id WHERE Release.country <>'Belgium';,,,1,
461,461,firstname461,lastname461,1,,,,1j,,,,,,"SELECT *,SUM(Track.duration) FROM Track JOIN Album.album_id ON Track.Album_id GROUP BY Album.album_id;",,,1,
461,461,firstname461,lastname461,1,,,,1k,,,,,,SELECT DISTINCT artist_id  FROM Performs WHERE Performs.role = 'vocals' HAVING COUNT(*) >= 3;,,,1,
461,461,firstname461,lastname461,1,,,,6d,,,,,,SELECT * AS managed FROM Employee WHERE employee_nr = 'U000001' or manager_nr = 'U000001' AND Employee = managed,,,1,
462,462,firstname462,lastname462,1,,,,1e,,,,,,SELECT name FROM Artist WHERE NOT death_date IS NULL;,,,1,
462,462,firstname462,lastname462,1,,,,1f,,,,,,"SELECT DISTINCT A.artist_id FROM Artist A, Performs P WHERE A.artist_id = P.artist_id AND role = ;",,,1,
462,462,firstname462,lastname462,1,,,,1g,,,,,,SELECT album_id FROM Release WHERE country = 'Belgium';,,,1,
462,462,firstname462,lastname462,1,,,,1h,,,,,,"SELECT song FROM Track T, Album A WHERE T.album_id = A.album_id AND A.title = 'Nevermind';",,,1,
462,462,firstname462,lastname462,1,,,,1i,,,,,,"SELECT title FROM Album A, Release R WHERE A.album_id = R.album_id AND country != 'Belgium';",,,1,
462,462,firstname462,lastname462,1,,,,1j,,,,,,"SELECT title, SUM(duration) AS total_duration FROM Album A JOIN Track T ON A.album_id = T.album_id   ;",,,1,
462,462,firstname462,lastname462,1,,,,1k,,,,,,"SELECT name, COUNT(*) AS num_vocals FROM Artist A, Performs P WHERE A.artist_id = P.artist_id AND .             ;",,,1,
462,462,firstname462,lastname462,1,,,,6d,,,,,,"WITH RECURSIVE SubordinateChain(employee_nr, manager_nr) AS ( SELECT employee_nr, manager_nr FROM Employee WHERE employee_nr = 'U000001'  UNION SELECT  E.employee_nr, E.manager_nr FROM Employee E, SubordinateChain S WHERE E.manager_nr = S.employee_nr ) SELECT employee_nr FROM SubordinateChain;",,,1,
463,463,firstname463,lastname463,1,,,,1e,,,,,,SELECT name FROM Artist WHERE NOT death_date IS NULL;,,,1,
463,463,firstname463,lastname463,1,,,,1f,,,,,,SELECT DISTINCT artist_id FROM Performs WHERE role = 'guitarist';,,,1,
463,463,firstname463,lastname463,1,,,,1g,,,,,,SELECT album_id FROM Release WHERE country = 'Belgium';,,,1,
463,463,firstname463,lastname463,1,,,,1h,,,,,,SELECT song FROM Track T JOIN Album A ON T.album_id = A.album_id WHERE A.title = 'Nevermind';,,,1,
463,463,firstname463,lastname463,1,,,,1i,,,,,,SELECT A.title FROM Album A JOIN Release R ON A.album_id = R.album_id WHERE NOT R.country = 'Belgium' GROUP BY R.album_id;,,,1,
463,463,firstname463,lastname463,1,,,,1j,,,,,,"SELECT A.title, SUM(T.duration) FROM Album A JOIN Track T ON A.album_id = T.album_id GROUP BY album_id;",,,1,
463,463,firstname463,lastname463,1,,,,1k,,,,,,"SELEECT A.name, COUNT(*) FROM Artist A JOIN Performs P ON A.artist_id = P.artist_id WHERE P.role = 'vocals' AND COUNT(P.artist_id) >= 3 ORDER BY DESC",,,1,
463,463,firstname463,lastname463,1,,,,6d,,,,,,WITH RECURSIVE all_sub_employees AS (  SELECT employee_nr FROM Employee WHERE employee_nr = 'U000001' OR manager_nr = 'U000001' UNION --recursive SELECT employee_nr FROM all_sub_employees JOIN Employee ON employee_nr = manager_nr ) SELECT * FROM all_sub_employees,,,1,
464,464,firstname464,lastname464,1,,,,1e,,,,,,SELECT name  FROM Artist WHERE death_date IS NULL;,,,1,
464,464,firstname464,lastname464,1,,,,1f,,,,,,SELECT DISTINCT artist_id FROM Perform  WHERE role = 'guitarist';,,,1,
464,464,firstname464,lastname464,1,,,,1g,,,,,,SELECT album_id FROM Release WHERE country = 'Belgium';,,,1,
464,464,firstname464,lastname464,1,,,,1h,,,,,,"SELECT t.song FROM Track t, Album a WHERE t.album_id = a.album_id AND a.title = 'Nevermind';",,,1,
464,464,firstname464,lastname464,1,,,,1i,,,,,,SELECT a.title FROM Album a WHERE NOT EXISTS( SELECT * FROM Release r WHERE a.album_id = r.album id AND r.country = 'Belgium');,,,1,
464,464,firstname464,lastname464,1,,,,1j,,,,,,"SELECT a.title, SUM(t.duration) FROM Album a, Track t WHERE a.album_id = t.album_id GROUP BY a.title;",,,1,
464,464,firstname464,lastname464,1,,,,1k,,,,,,"SELECT a.name, COUNT(p.track_id) AS nr FROM Artist a, Performs p WHERE a.artist_id = p.artist_id AND p.role = 'Vocals' GROUP BY a.name HAVING nr >=3 ORDER BY nr DESC;",,,1,
464,464,firstname464,lastname464,1,,,,6d,,,,,,"WITH RECURSIVE Managing(employee_nr, manager_nr) AS ( SELECT employee_nr, manager_nr FROM Employee WHERE manager_nr = 'U000001' UNION SELECT employee_nr, manager_nr FROM Managing m, Employee e WHERE m.manager_id = e.manager_id AND NOT employee_nr IS NULL) SELECT * FROM Managing;",,,1,
465,465,firstname465,lastname465,1,,,,1e,,,,,,SELECT name  FROM Artist  WHERE death_date IS NULL;,,,1,
465,465,firstname465,lastname465,1,,,,1f,,,,,,"SELECT DISTINCT A.artist_id  FROM Artist A,Performs P WHERE A.artist_id=P.artist_id AND P.role=´guitarist´;",,,1,
465,465,firstname465,lastname465,1,,,,1g,,,,,,"SELECT A.album_id  FROM Album A,Realease R WHERE A.album_id=R.album_id  AND R.country=´Belgium´;",,,1,
465,465,firstname465,lastname465,1,,,,1h,,,,,,"Select T.song  FROM Album A,Track T WHERE A.album_id=T.album_id AND A.title=´Nevermind´;",,,1,
465,465,firstname465,lastname465,1,,,,1i,,,,,,SELECT A.title  FROM Album A WHERE NOT EXISTS (  SELECT * FROM Realease R  WHERE A.album_id=R.album_id AND R.country=´Belgium´ );,,,1,
465,465,firstname465,lastname465,1,,,,1j,,,,,,"SELECT A.title, SUM(T.duration) AS tduration FROM Album A,Track T  WHERE A.album_id=T.album_id GROUP BY A.title;",,,1,
465,465,firstname465,lastname465,1,,,,1k,,,,,,"SELECT A.name,COUNT(P.track_id) AS nr FROM Artist A,Performs P,Track T WHERE A.artist_id=P.artist_id AND P.role=´vocals´ GROUP BY A.name HAVING COUNT(*)>=3 ORDER BY nr DESC;",,,1,
465,465,firstname465,lastname465,1,,,,6d,,,,,,"WITH RECURSIVE Managed_chain (employee_nr,manager_nr)AS( SELECT employee_nr  FROM Employee WHERE manager_nr=´U000001´ UNION SELECT E.employee_nr FROM Managed_chain M,Employee E WHERE E.manager_nr=M.manager_nr ) SELECT employee_nr FROM Managed_chain;",,,1,
466,466,firstname466,lastname466,1,,,,1e,,,,,,SELECT name FROM Artist WHERE death_date IS NULL;,,,1,
466,466,firstname466,lastname466,1,,,,1f,,,,,,SELECT DISTINCT artist_id FROM Performs WHERE role='guitarist';,,,1,
466,466,firstname466,lastname466,1,,,,1g,,,,,,SELECT album_id FROM Release WHERE country='Belgium';,,,1,
466,466,firstname466,lastname466,1,,,,1h,,,,,,"SELECT T.song FROM Track T, Album A WHERE T.album_id=A.album_id AND A.title='Nevermind';",,,1,
466,466,firstname466,lastname466,1,,,,1i,,,,,,SELECT A.title FROM Album A WHERE NOT EXISTS(  SELECT *  FROM Release R  WHERE R.album_id=A.album_id  AND R.country='Belgium');,,,1,
466,466,firstname466,lastname466,1,,,,1j,,,,,,"SELECT A.title, SUM(T.duration) AS seconds FROM Album A, Track T WHERE A.album_id=T.album_id GROUP BY A.title;",,,1,
466,466,firstname466,lastname466,1,,,,1k,,,,,,"SELECT A.name, COUNT(*) as total FROM Artist A, Performs P WHERE A.artist_id=P.artist_id AND P.role='vocals' GROUP BY A.name HAVING total > 2 ORDER BY total DESC;",,,1,
466,466,firstname466,lastname466,1,,,,6d,,,,,,"WITH RECURSIVE employee_hierarchy AS( SELECT employee_nr FROM Employee WHERE employee_nr= 'U000001' UNION SELECT E.employee_nr FROM Employee E, employee_hierarchy H WHERE E.manager_nr=H.employee_nr ) SELECT * FROM employee_hierarchy;",,,1,
467,467,firstname467,lastname467,1,,,,1e,,,,,,SELECT artist_id FROM Artist WHERE death_date IS NULL;,,,1,
467,467,firstname467,lastname467,1,,,,1f,,,,,,SELECT artist_id FROM Performs  WHERE role = 'guitarist';,,,1,
467,467,firstname467,lastname467,1,,,,1g,,,,,,SELECT album_id FROM Release WHERE country = 'Belgium';,,,1,
467,467,firstname467,lastname467,1,,,,1h,,,,,,SELECT track_id FROM Track WHERE album_id = 'Nevermind';,,,1,
467,467,firstname467,lastname467,1,,,,1i,,,,,,SELECT album_id FROM Release WHERE country <> 'Belgium';,,,1,
467,467,firstname467,lastname467,1,,,,1j,,,,,,"SELECT track_id, COUNT(duration) FROM Track SUM(duration) FROM track_id GROUP BY album_id;",,,1,
467,467,firstname467,lastname467,1,,,,1k,,,,,,"SELECT artist_id, COUNT(role)  FROM Performs WHERE (role = 'vocals') > 3  ORDER BY Desc;",,,1,
467,467,firstname467,lastname467,1,,,,6d,,,,,,WITH RECURSIVE ( SELECT employee_nr* FROM Employee WHERE Manager_nr = NULL Manager_nr = employee_nr );,,,1,
468,468,firstname468,lastname468,1,,,,1e,,,,,,SELECT name FROM Artist WHERE death_date IS NULL;,,,1,
468,468,firstname468,lastname468,1,,,,1f,,,,,,SELECT DISTINCT artist_id FROM Performs WHERE role='guitarist';,,,1,
468,468,firstname468,lastname468,1,,,,1g,,,,,,SELECT album_id FROM Release WHERE country='Belgium';,,,1,
468,468,firstname468,lastname468,1,,,,1h,,,,,,"SELECT Track.song FROM Track, Album WHERE Track.album_id = Album.album_id AND Album.title='Nevermind';",,,1,
468,468,firstname468,lastname468,1,,,,1i,,,,,,"SELECT DISTINCT Album.title FROM Album, Release WHERE Album.album_id = Release.album_id AND Release.country <> 'Belgium';",,,1,
468,468,firstname468,lastname468,1,,,,1j,,,,,,"SELECT Album.title, SUM(Track.duration) FROM Album, Track WHERE Album.album_id = Track.album_id;",,,1,
468,468,firstname468,lastname468,1,,,,1k,,,,,,"SELECT Artist.name, COUNT(Performs.track_id) FROM Artist, Performs WHERE Artist.artist_id = Performs.artist_id AND Performs.role ='vocals' GROUP BY Artist.name HAVING SUM(CASE WHEN Performs.role='vocals' THEN 1 ELSE 0 END) >= 3 ORDER BY COUNT(Performs.track_id) DESC;",,,1,
468,468,firstname468,lastname468,1,,,,6d,,,,,,"WITH RECURSIVE ManagedByU000001(id) (     SELECT E.employee_nr AS id     FROM Employee E     WHERE E.manager_nr='U000001'     UNION     SELECT E.employee_nr AS id     FROM Employee E,ManagedByU000001(id) M      WHERE E.id = M.id ) SELECT * FROM ManagedByU000001;",,,1,
469,469,firstname469,lastname469,1,,,,1e,,,,,,SELECT name FROM Artist WHERE death_date IS NULL;,,,1,
469,469,firstname469,lastname469,1,,,,1f,,,,,,SELECT DISTINCT artist_id FROM Performs WHERE role = 'guitarist';,,,1,
469,469,firstname469,lastname469,1,,,,1g,,,,,,SELECT album_id FROM Release WHERE country = 'Belgium';,,,1,
469,469,firstname469,lastname469,1,,,,1h,,,,,,"SELECT song FROM Track, Album WHERE Track.album_id = Album.album_id AND title = 'Nevermind';",,,1,
469,469,firstname469,lastname469,1,,,,1i,,,,,,SELECT title FROM Album WHERE NOT EXISTS (     SELECT * FROM Release     WHERE Album.album_id = Release.album_id     AND country = 'Belgium');,,,1,
469,469,firstname469,lastname469,1,,,,1j,,,,,,"SELECT title, SUM(duration) FROM Album, Track WHERE Album.album_id = Track.album_id GROUP BY title;",,,1,
469,469,firstname469,lastname469,1,,,,1k,,,,,,"SELECT name, COUNT(*) FROM Artist, Performs WHERE Artist.artist_id = Performs.artist_id AND role = 'vocals' GROUP BY name HAVING COUNT(*) >= 3 ORDER BY COUNT(*) DESC;",,,1,
469,469,firstname469,lastname469,1,,,,6d,,,,,,"WITH RECURSIVE Below_U000001(employee_nr) AS (     'U000001'     UNION     SELECT E.employee_nr FROM Below_U000001 B, Employee E     WHERE B.employee_nr = E.manager_nr ); SELECT * FROM Below_U000001;",,,1,
470,470,firstname470,lastname470,1,,,,1e,,,,,,SELECT DISTINCT A.name  FROM Artist A WHERE A.death_date IS NULL;,,,1,
470,470,firstname470,lastname470,1,,,,1f,,,,,,"SELECT  A.artist_id FROM Artist A , Performs P WHERE A.artist_id = P.artist_id AND P.role = 'guitarist';",,,1,
470,470,firstname470,lastname470,1,,,,1g,,,,,,"SELECT A.album_id FROM Album A, Release R WHERE A.album_id = R.album_id ANd R.country = 'Belgium';",,,1,
470,470,firstname470,lastname470,1,,,,1h,,,,,,"SELECT DISTINCT T.song FROM Track T, Album A WHERE T.album_id = A.album_id AND A.title = 'Nevermind';",,,1,
470,470,firstname470,lastname470,1,,,,1i,,,,,,SELECT DISTINCT A.title FROM Album A WHERE NOT EXISTS  (SELECT * FROM Release R WHERE R.album_id = A.album_id AND R.country = 'Belgium');,,,1,
470,470,firstname470,lastname470,1,,,,1j,,,,,,"SELECT DISTINCT A.title, SUM(T.duraton) FROM Album A, Track T WHERE A.album_id = T.album_id GROUP BY A.title;",,,1,
470,470,firstname470,lastname470,1,,,,1k,,,,,,"SELECT P.artist_id, COUNT(*) AS performances FROM Performs P WHERE P.role = 'vocals' GROUP BY P.artist_id HAVING performances >= 3 ORDER BY performances DESC;",,,1,
470,470,firstname470,lastname470,1,,,,6d,,,,,,"WITH Recursion Ancestor(employee_nr) AS (      SELECT E.employee_nr        FROM Employee E      WHERE E.employee_nr = 'U000001'     UNION      SELECT E.employee_nr      FROM Ancestor A, Employee E      WHERE E.maneger_nr = A.employee_nr) SELECT * FROM Ancestor;",,,1,
471,471,firstname471,lastname471,1,,,,1e,,,,,,SELECT Artist.name FROM Artist WHERE NOT Artist.death_rate IS NULL;,,,1,
471,471,firstname471,lastname471,1,,,,1f,,,,,,SELECT DISTINCT Performs.artist_id FROM Performs wHERE Performs.role = 'guitarist';,,,1,
471,471,firstname471,lastname471,1,,,,1g,,,,,,SELECT Release.album_id FROM Release WHERE Release.country = 'Belgium';,,,1,
471,471,firstname471,lastname471,1,,,,1h,,,,,,"SELECT Track.song FROM Track, Album WHERE Track.album_id = Album.album_id AND Album.title = 'Nevermind';",,,1,
471,471,firstname471,lastname471,1,,,,1i,,,,,,SELECT DISTINCT Album.title FROM Album WHERE NOT EXISTS ( SELECT * FROM Release WHERE Album.album_id = Release.album_id AND Release.country = 'Belgium' );,,,1,
471,471,firstname471,lastname471,1,,,,1j,,,,,,"SELECT Album.title, SUM(Track.duration) FROM Album, Track WHERE Album.album_id = Track.album_id GROUP BY Album.title;",,,1,
471,471,firstname471,lastname471,1,,,,1k,,,,,,"SELECT A.name, COUNT(T.song) FROM Artist A, Track T, Performs P WHERE A.artist_id = P.artist_id AND P.track_id = T.track_id AND P.role = 'vocals' GROUP BY A.name HAVING COUNT(T.song) >= 3 ORDER BY COUNT(T.song) DESC;",,,1,
471,471,firstname471,lastname471,1,,,,6d,,,,,,"WITH RECURSIVE Employment (manager_nr, employee_nr) AS( SELECT manager_nr, employee_nr FROM Employee UNION SELECT manager_nr, employee_nr FROM Employee E, Employee E2 WHERE E.employee_nr = E2.manager_nr ) SELECT employee_nr FROM Employee WHERE manager_nr = 'U000001';",,,1,
472,472,firstname472,lastname472,1,,,,1e,,,,,,SELECT name FROM Artist WHERE death_date IS NULL,,,1,
472,472,firstname472,lastname472,1,,,,1f,,,,,,"SELECT artist_id FROM Performs WHERE role=""guitarist""",,,1,
472,472,firstname472,lastname472,1,,,,1g,,,,,,"SELECT album_id FROM Release WHERE country=""Belgium""",,,1,
472,472,firstname472,lastname472,1,,,,1h,,,,,,"SELECT song FROM Track, Album WHERE Track.album_id = Album.album_id",,,1,
472,472,firstname472,lastname472,1,,,,1i,,,,,,"SELECT title FROM Album, Release WHERE Album.album_id = Release.album_id AND country <> ""Belgium""",,,1,
472,472,firstname472,lastname472,1,,,,1j,,,,,," SELECT title, SUM(duration) FROM Track, Album GROUP BY title WHERE Track.album_id = Album.album_id",,,1,
472,472,firstname472,lastname472,1,,,,1k,,,,,,"SELECT name, COUNT(track_id) FROM Artist, Performs HAVING COUNT(track_id) > 3 WHERE role = ""vocals""  .  .",,,1,
472,472,firstname472,lastname472,1,,,,6d,,,,,,"SELECT answer FROM exam_keys WHERE exam_name=""Information Modelling and Databases | Tweede deeltentamen/DIGI | 1e gelegenheid | NWI-IPC033 | 2024-25 | KW1""  ",,,1,
473,473,firstname473,lastname473,1,,,,1e,,,,,,SELECT DISTINCT Artist.name FROM Artist WHERE death_date IS NULL;,,,1,
473,473,firstname473,lastname473,1,,,,1f,,,,,,SELECT DISTINCT Artist.artist_id  FROM Artist JOIN Performs ON Artist.artist_id = Performs.artist_id WHERE Performs.role = ´guitarist´;,,,1,
473,473,firstname473,lastname473,1,,,,1g,,,,,,SELECT DISTINCT Release.album_id FROM Release WHERE Release.country = ´Belgium´;,,,1,
473,473,firstname473,lastname473,1,,,,1h,,,,,,SELECT DISTINCT Track.song  FROM Track JOIN Album ON Track.album_id = Album.album_id WHERE Album.title = ´Nevermind´;,,,1,
473,473,firstname473,lastname473,1,,,,1i,,,,,,SELECT DISTINCT Album.title FROM Album JOIN Release ON Album.album_id = Release.album_id WHERE Release.country <> ´Belgium´;,,,1,
473,473,firstname473,lastname473,1,,,,1j,,,,,,"SELECT Album.title, SUM(DISTINCT Track.duration) AS album_duration FROM Album JOIN Track ON Album.album_id = Track.album_id GROUP BY Album.title; ",,,1,
473,473,firstname473,lastname473,1,,,,1k,,,,,,"SELECT Artist.name, COUNT(DISTINCT Performs.track_id) AS nr_tracks FROM Performs  JOIN Artist ON Performs.artist_id = Artist.artist_id WHERE Performs.role = ´vocals´ GROUP BY Artist.name HAVING nr_tracks >= 3 ORDER BY nr_tracks DESC;",,,1,
473,473,firstname473,lastname473,1,,,,6d,,,,,,"WITH RECURSIVE ManagerEmployee AS ( -- Base Case: direct manager - employee relationships SELECT employee FROM Employee UNION -- Recursive Case: indirect relationship through intermeiate employee SELECT m.manager, e.employee FROM ManagerEmployee e JOIN Employee e ON m.employee = e.manager ) SELECT employee FROM ManagerEmployee;",,,1,
474,474,firstname474,lastname474,1,,,,1e,,,,,,SELECT A.name FROM Artist A WHERE A.death_date IS NULL;,,,1,
474,474,firstname474,lastname474,1,,,,1f,,,,,,SELECT DISTINCT P.artist_id FROM Performs P WHERE P.role = 'guitarist';,,,1,
474,474,firstname474,lastname474,1,,,,1g,,,,,,SELECT R.album_id FROM Release R WHERE R.country = 'Belgium';,,,1,
474,474,firstname474,lastname474,1,,,,1h,,,,,,"SELECT T.song FROM Track T, Album A WHERE A.title = 'Nevermind' AND T.album_id = A.album_id;",,,1,
474,474,firstname474,lastname474,1,,,,1i,,,,,,"SELECT DISTINCT A.title FROM Album A, Release R WHERE A.album_id = R.album_id AND A.album_id NOT IN     (     SELECT R1.album_id     FROM Release R1     WHERE R1.country = 'Belgium'     );",,,1,
474,474,firstname474,lastname474,1,,,,1j,,,,,,"SELECT A.title, SUM(T.duration) FROM Album A, Track T WHERE A.album_id = T.album_id GROUP BY A.title;",,,1,
474,474,firstname474,lastname474,1,,,,1k,,,,,,"SELECT A.name, COUNT(*) FROM Artist A, Performs P WHERE P.role = 'vocals' AND A.artist_id = P.artist_id GROUP BY A.name HAVING COUNT(*) >= 3 ORDER BY COUNT(*) DESC;",,,1,
