Org Defined ID,Username,FirstName,LastName,Attempt #,Attempt Start,Attempt End,Section #,Q #,Q Type,Q Title,Q Text,Bonus?,Difficulty,Answer,Answer Match,Score,Out Of,Feedback
377,377,firstname377,lastname377,1,,,,1i,,,,,,"SELECT Album.title FROM Album, Release WHERE Album.album_id = Release.album_id AND NOT Release.country = 'Belgium'",,,1,
377,377,firstname377,lastname377,1,,,,1j,,,,,,"SELECT Album.title, SUM(duration) FROM Album, Track WHERE Album.album_id = Track.album_id  GROUP BY Album.album_id, Album.title",,,1,
377,377,firstname377,lastname377,1,,,,1k,,,,,,"SELECT Artist.name, COUNT(*), FROM Artist, Performs WHERE Artist.artist_id = Performs.artist_id AND Performs.role = 'guitarist' AND COUNT(*)>2 GROUP BY Performs.role",,,1,
377,377,firstname377,lastname377,1,,,,6d,,,,,,"WITH RECURSIVE EmployeeTree(id) AS( Select X.manager_nr AS id FROM Employee X WHERE X.manager_nr = 'U000001') UNION  (SELECT X.manager_nr AS id FROM EmployeeTree Y, Employee X WHERE Y.id = X.id) SELECT * FROM EmployeeTree;",,,1,
378,378,firstname378,lastname378,1,,,,1e,,,,,,SELECT name FROM Artist WHERE death_date IS NULL;,,,1,
378,378,firstname378,lastname378,1,,,,1f,,,,,,SELECT DISTINCT artist_id FROM Performs WHERE role=´guitarist´;,,,1,
378,378,firstname378,lastname378,1,,,,1g,,,,,,SELECT album_id FROM Release WHERE country=´Belgium´;,,,1,
378,378,firstname378,lastname378,1,,,,1h,,,,,,"SELECT Track.song FROM Track, Album WHERE Track.album_id = Album.album_id AND Album.title=´Nevermind´;",,,1,
378,378,firstname378,lastname378,1,,,,1i,,,,,,"SELECT Album.title FROM Album, Release  WHERE Album.album_id = Release.album_id AND NOT EXISTS Release.country = ´Belgium´;",,,1,
378,378,firstname378,lastname378,1,,,,1j,,,,,,"SELECT title, SUM(duration) FROM Album, Track WHERE Album.album_id = Track.album_id GROUP BY Album.album_id;",,,1,
378,378,firstname378,lastname378,1,,,,1k,,,,,,"SELECT Artist.name, COUNT(*) FROM Artist, Performs WHERE Artist.artist_id = Performs.artist_id AND Performs.role = ´vocals´ GROUP BY artist_id HAVING COUNT(*) >= 3;",,,1,
378,378,firstname378,lastname378,1,,,,6d,,,,,,"WITH RECURSIVE Managed_by_one(nr) AS (     SELECT E1.employee_nr     FROM Employee E1     WHERE E1.employee_nr = ´U000001´     UNION     SELECT E2.employee_nr     FROM Employee E2, Managed_by_one M1     WHERE E2.manager_nr = M1.nr ) SELECT * FROM Managed_by_one;",,,1,
379,379,firstname379,lastname379,1,,,,1e,,,,,,SELECT Artis.name FROM Artist WHERE Artist.death_date IS NULL;,,,1,
379,379,firstname379,lastname379,1,,,,1f,,,,,,SELECT DISTINCT Performs.artist_id FROM Performs WHERE Performs.role = 'guitarist';,,,1,
379,379,firstname379,lastname379,1,,,,1g,,,,,,SELECT album_id FROM Release WHERE 'Belgium' IN (SELECT country FROM Release);,,,1,
379,379,firstname379,lastname379,1,,,,1h,,,,,,"SELECT Track.songs FROM Track, Album WHERE Track.album_id = Album.album_id AND Album.title = 'Nevermind';",,,1,
379,379,firstname379,lastname379,1,,,,1i,,,,,,SELECT Album.title FROM Album WHERE NOT EXISTS (SELECT * FROM Release WHERE Album.album_id = Release.  .  ;,,,1,
379,379,firstname379,lastname379,1,,,,1j,,,,,,"SELECT Album.title, SUM(Track.duration) FROM Album, Track WHERE Album.album_id = Track.album_id;",,,1,
379,379,firstname379,lastname379,1,,,,1k,,,,,,"SELECT Artist.name, COUNT(*) AS number FROM Artist, Performs WHERE Artist.artist_id = Performs.artist_id  .     .  *      ;",,,1,
379,379,firstname379,lastname379,1,,,,6d,,,,,,"WITH RECURSIVE Managed_by(manager_nr, employee_nr) AS (SELECT manager_nr, employee_nr FROM Employee   ., .   ,    .  .  .   ,  ,    .  .  .  .  .  ;",,,1,
380,380,firstname380,lastname380,1,,,,1e,,,,,,SELECT name FROM Artist WHERE death_date IS NULL;,,,1,
380,380,firstname380,lastname380,1,,,,1f,,,,,,SELECT DISTINCT artist_id FROM Performs WHERE role = 'guitarist';,,,1,
380,380,firstname380,lastname380,1,,,,1g,,,,,,SELECT album_id  FROm Release  WHERE country = 'Belgium';,,,1,
380,380,firstname380,lastname380,1,,,,1h,,,,,,"SELECT song FROM Track T, Album A WHERE album_id.T = album_id.A AND title = 'Nevermind';",,,1,
380,380,firstname380,lastname380,1,,,,1i,,,,,,"SELECT title FROM Release R, Album A WHERE album_id.R = album_id.A ANd country <> 'Belgium';",,,1,
380,380,firstname380,lastname380,1,,,,1j,,,,,,"SELECT title, SUM(duration) FROM Track T, Album A WHERE album_id.T = album_id.A;",,,1,
380,380,firstname380,lastname380,1,,,,1k,,,,,,"SELECT name, COUNT(song) FROM Artist A, Performs P WHERE role = 'vocals' AND COUNT(song) >= 3 ORDER BY DESC LIMIT 5;",,,1,
380,380,firstname380,lastname380,1,,,,6d,,,,,,WITH RECURSIVE managers AS (     SELECT name     FROM Employee     WHERE ) SELECT *  FROM managers;,,,1,
381,381,firstname381,lastname381,1,,,,1e,,,,,,SELECT name FROM Artist WHERE death_date NOT NULL;,,,1,
381,381,firstname381,lastname381,1,,,,1f,,,,,,"SELECT DISTINCT A.artist_id FROM Artist A, Performs P WHERE A.artist_id = P.artist_id AND P.role = 'guitarist';",,,1,
381,381,firstname381,lastname381,1,,,,1g,,,,,,SELECT album_id FROM Release WHERE country = 'Belgium';,,,1,
381,381,firstname381,lastname381,1,,,,1h,,,,,,"SELECT T.song FROM Track T, Album A WHERE T.album_id = A.album_id AND A.title = 'Nevermind';",,,1,
381,381,firstname381,lastname381,1,,,,1i,,,,,,SELECT A.title FROM Album A WHERE NOT 'Belgium' IN ( SELECT R.country  FROM Release R WHERE R.album_id = A.album_id );,,,1,
381,381,firstname381,lastname381,1,,,,1j,,,,,,"SELECT A.title, SUM(duration) FROM Album A, Track T WHERE A.album_id = T.album_id GROUP BY A.title;",,,1,
381,381,firstname381,lastname381,1,,,,1k,,,,,,"SELECT A.name, COUNT(*) AS nr_tracks FROM Artist A, Performs P WHERE A.artist_id = P.artist_id AND P.role = 'vocals' GROUP BY A.name ORDER BY nr_tracks DESC;",,,1,
381,381,firstname381,lastname381,1,,,,6d,,,,,,"WITH RECURSIVE Managed(employee_nr) AS ( SELECT employee_nr AS employee_nr FROM Employee WHERE employee_nr = 'U000001' UNION SELECT E.employee_nr AS employee_nr FROM Employee E, Managed M WHERE E.manager_nr = M.employee_nr ) SELECT * FROM Managed;",,,1,
382,382,firstname382,lastname382,1,,,,1e,,,,,,SELECT NAME FROM ARTIST WHERE DEATH_DATE IS NULL;,,,1,
382,382,firstname382,lastname382,1,,,,1f,,,,,,SELECT ARTIST_ID FROM PERFORMS WHERE ROLE = ´guitarist´;,,,1,
382,382,firstname382,lastname382,1,,,,1g,,,,,,SELECT ALBUM_ID FROM RELEASE WHERE COUNTRY = ´BELGIUM´;,,,1,
382,382,firstname382,lastname382,1,,,,1h,,,,,,"SELECT T.SONG FROM TRACK T, ALBUM A WHERE T.ALBUM_ID = A.ALBUM_ID AND A.TITLE = ´Nevermind´;",,,1,
382,382,firstname382,lastname382,1,,,,1i,,,,,,"SELECT DISTINCT A.TITLE FROM ALBUM A, RELEASE R WHERE A.ALBUM_ID = R.ALBUM_ID AND R.COUNTRY <> ´Belgium´;",,,1,
382,382,firstname382,lastname382,1,,,,1j,,,,,,"SELECT A.ALBUM_ID, A.TITLE, SUM(T.DURATION) FROM ALBUM A NATURAL JOIN TRACK T GROUP BY A.ALBUM_ID;",,,1,
382,382,firstname382,lastname382,1,,,,1k,,,,,,"SELECT A.ARTIST_ID, A.NAME, COUNT(P.TRACK_ID) FROM ARTIST A NATURAL JOIN PRERFORMS P WHERE P. ROLE  ´´  .   .   ;",,,1,
382,382,firstname382,lastname382,1,,,,6d,,,,,,"WITH RECURSIVE MANAGED AS  (SELECT employee_nr FROM Employee WHERE manager_nr = 'U000001'  UNION SELECT E.employee_nr FROM MANAGED M, EMPLOYEE E WHERE M.EMPLOYEE_NR = E.MANAGER_NR)  SELECT * FROM MANAGED;",,,1,
383,383,firstname383,lastname383,1,,,,1e,,,,,,SELECT name FROM Artist WHERE birth_date IS NULL;,,,1,
383,383,firstname383,lastname383,1,,,,1f,,,,,,SELECT DISTINCT artist_id FROM Performs WHERE role='guitarist'; -- We use distinct because an artist can be a guitarist on multiple tracks,,,1,
383,383,firstname383,lastname383,1,,,,1g,,,,,,SELECT album_id FROM Release WHERE country='Belgium'; -- We do not use DISTINCT because an album can only be released once (as far as I know),,,1,
383,383,firstname383,lastname383,1,,,,1h,,,,,,"SELECT T.song FROM Track T, Album A WHERE T.album_id=A.album_id AND A.title='Nevermind';",,,1,
383,383,firstname383,lastname383,1,,,,1i,,,,,,"SELECT A.title FROM Album A, Release R WHERE R.album_id=A.album_id AND R.country <> 'Belgium';",,,1,
383,383,firstname383,lastname383,1,,,,1j,,,,,,"SELECT A.title, SUM(T.duration) FROM Album A, Track T WHERE A.album_id=T.album_id;",,,1,
383,383,firstname383,lastname383,1,,,,1k,,,,,,"SELECT A.name, COUNT(*) AS number  FROM Artist A, Performs P  WHERE A.artist_id=P.artist_id AND P.role='vocals' GROUP BY A.name HAVING COUNT(*)>=3 ORDER BY number DESC;",,,1,
383,383,firstname383,lastname383,1,,,,6d,,,,,,"WITH RECURSIVE ManagerJose(employee_nr, manager_nr) AS (     (         SELECT employee_nr, manager_nr         FROM Employee     )     UNION     (         SELECT E.employee_nr, E.manager_nr         FROM ManagerJose M, Employee E         WHERE M.employee_nr = E.manager_nr         AND NOT E.employee_nr='U000001'     ) ) SELECT * FROM ManagerJose;",,,1,
384,384,firstname384,lastname384,1,,,,1e,,,,,,SELECT name FROM Artist WHERE death_date IS NULL;,,,1,
384,384,firstname384,lastname384,1,,,,1f,,,,,,"SELECT artist_id FROM Performs WHERE role = 'guitarist' GROUP BY artist_id; -- group by to avoid needing DISTINCT  -- (DISTINCT is much better, but it is not necessary for desired result)",,,1,
384,384,firstname384,lastname384,1,,,,1g,,,,,,SELECT album_id FROM Release WHERE country = 'Belgium'; -- provided that Belgium releases are stored as 'Belgium'.,,,1,
384,384,firstname384,lastname384,1,,,,1h,,,,,,SELECT Track.song FROM Track JOIN Album ON Track.album_id = Album.album_id WHERE Album.title = 'Nevermind';,,,1,
384,384,firstname384,lastname384,1,,,,1i,,,,,,"SELECT Album.title FROM Album JOIN Release ON Album.album_id = Release.album_id WHERE Release.country   ; -- I know that IS NOT can be writen as <>, but im not sure if that was used in the course yet.",,,1,
384,384,firstname384,lastname384,1,,,,1j,,,,,,"SELECT Album.title, SUM(Track.duration) AS 'Duration in seconds' FROM Album JOIN Track ON Album.album_id  .   .;",,,1,
384,384,firstname384,lastname384,1,,,,1k,,,,,,"SELECT Artist.name, COUNT(Performs.track_id) AS 'Number of Tracks' FROM Artist JOIN Performs ON Artist.  .   .  .     . ;",,,1,
384,384,firstname384,lastname384,1,,,,6d,,,,,,WITH RECURSIVE Under1 employee_nr AS(     SELECT Employee.employee_nr AS `id`     FROM Employee     WHERE Employee.manager_nr = `U000001`     UNION     SELECT Employee.employee_nr AS `id`     FROM Under1     WHERE Under1.id = manager.id ) SELECT * FROM Under1;,,,1,
385,385,firstname385,lastname385,1,,,,1e,,,,,,SELECT Artist.name FROM Artist WHERE Artist.death_date = NULL;,,,1,
385,385,firstname385,lastname385,1,,,,1f,,,,,,SELECT DISTINCT Artist.artist_id FROM Artist JOIN Perform ON Artist.artist_id = Perform.artist_id WHERE Perform.role = 'guitarist';,,,1,
385,385,firstname385,lastname385,1,,,,1g,,,,,,SELECT DISTINCT Album.album_id FROM Album JOIN Release ON Album.album_id = Release.album_id WHERE Release.country = 'Belgium';,,,1,
385,385,firstname385,lastname385,1,,,,1h,,,,,,SELECT Track.song FROM Track WHERE Track.album_id IN (     SELECT Album.album_id     FROM Album     WHERE Album.title = 'Nevermind' );,,,1,
385,385,firstname385,lastname385,1,,,,1i,,,,,,SELECT Album.title FROM Album WHERE Album.album_id NOT IN (     SELECT Release.album_id     FROM Release     WHERE Release.country = 'Belgium' );,,,1,
385,385,firstname385,lastname385,1,,,,1j,,,,,,"SELECT Album.title, SUM(Track.duration) FROM Album JOIN Track ON Album.album_id = Track.album_id;",,,1,
385,385,firstname385,lastname385,1,,,,1k,,,,,,"SELECT Artist.name, COUNT(DISTINCT Performs.role) AS role_count  FROM Artist JOIN Performs ON Artist.artist_id = Performs.artist_id WHERE Performs.role = 'vocals' HAVING COUNT(DISTINCT Performs.role) >= 3 ORDER BY role_count DESC;",,,1,
385,385,firstname385,lastname385,1,,,,6d,,,,,,WITH RECURSIVE EmployeeTree AS (     --BASE CASE     SELECT DISTINCT E.employee_nr     FROM Employee E     WHERE E.employee_nr = 'U000001'         UNION ALL         --Recursive     SELECT DISTINCT E.id     FROM EmployeeTree T     JOIN Employee E ON E.manager_nr = T.employee_nr ) SELECT DISTINCT T.employee_nr FROM EmployeeTree T;,,,1,
386,386,firstname386,lastname386,1,,,,1e,,,,,,SELECT name FROM Artist WHERE death_date IS NuLL;,,,1,
386,386,firstname386,lastname386,1,,,,1f,,,,,,SELECT DISTINCT artist_id FROM Artist NATURAL JOIN Performs WHERE role = 'guitarist';,,,1,
386,386,firstname386,lastname386,1,,,,1g,,,,,,SELECT album_id FROM Performs WHERE country = 'Belgium';,,,1,
386,386,firstname386,lastname386,1,,,,1h,,,,,,SELECT song FROM Track NATURAL JOIN Album WHERE title = 'Nevermind';,,,1,
386,386,firstname386,lastname386,1,,,,1i,,,,,,SELECT DISTINCT title FROM Album NATURAL JOIN Release WHERE country != 'Belgium';,,,1,
386,386,firstname386,lastname386,1,,,,1j,,,,,,"SELECT title, SUM(duration) FROM Album NATURAL JOIN Track WHERE Track.album_id = Album.album_id;",,,1,
386,386,firstname386,lastname386,1,,,,1k,,,,,,,,,1,
386,386,firstname386,lastname386,1,,,,6d,,,,,,SELECT employee_nr FROM Employee WHERE manager_nr IS NULL OR manager_nr = 'U000001' OR manager_nr  ;,,,1,
387,387,firstname387,lastname387,1,,,,1e,,,,,,SELECT name FROM Artist WHERE NOT death_date IS NULL;,,,1,
387,387,firstname387,lastname387,1,,,,1f,,,,,,SELECT DISTINCT artist_id FROM Performs WHERE role='guitarist';,,,1,
387,387,firstname387,lastname387,1,,,,1g,,,,,,SELECT album_id FROM Release WHERE country='Belgium';,,,1,
387,387,firstname387,lastname387,1,,,,1h,,,,,,SELECT song FROM Track WHERE album_id='Nevermind';,,,1,
387,387,firstname387,lastname387,1,,,,1i,,,,,,SELECT title  FROM Album JOIN Release ON album_id WHERE country='Belgium';,,,1,
387,387,firstname387,lastname387,1,,,,1j,,,,,,"SELECT title, SUM(duration) FROM Track JOIN Album ON album_id GROUP BY title;",,,1,
387,387,firstname387,lastname387,1,,,,1k,,,,,,"SELECT name, COUNT(track_id) FROM Artist JOIN Performs ON artist_id WHERE role='vocals' GROUP BY name HAVING COUNT(*)>2 ORDER BY COUNT(*);",,,1,
387,387,firstname387,lastname387,1,,,,6d,,,,,,"WITH RECURSIVE ManagerTree(employee_nr) AS ( SELECT employee_nr, manager_nr FROM Employee WHERE manager_nr = 'U000001' UNION SELECT employee_nr, manager_nr FROM Employee WHERE manager_nr IN Employee AND NOT NULL; ) SELECT * FROM ManagerTree;",,,1,
388,388,firstname388,lastname388,1,,,,1e,,,,,,SELECT name FROM Artist WHERE death_date IS NULL;,,,1,
388,388,firstname388,lastname388,1,,,,1f,,,,,,SELECT DISTINCT artist_id FROM Artist NATURAL JOIN Performs WHERE role = ´guitarist´;,,,1,
388,388,firstname388,lastname388,1,,,,1g,,,,,,SELECT album_id FROM Album NATURAL JOIN Release WHERE country = ´Belgium´;,,,1,
388,388,firstname388,lastname388,1,,,,1h,,,,,,SELECT song FROM Album NATURAL JOIN Track WHERE title = ´Nevermind´;,,,1,
388,388,firstname388,lastname388,1,,,,1i,,,,,,SELECT title FROM Album NATURAL JOIN Release WHERE country <> ´Belgium´;,,,1,
388,388,firstname388,lastname388,1,,,,1j,,,,,,"SELECT title, SUM(*) FROM Album NATURAL JOIN Track;",,,1,
388,388,firstname388,lastname388,1,,,,1k,,,,,,"SELECT name, COUNT(*) FROM Artist NATURAL JOIN Performs WHERE role = ´vocals´ GROUP BY name HAVING COUNT(*) >= 3 ORDER BY DESC;",,,1,
388,388,firstname388,lastname388,1,,,,6d,,,,,,SELECT * FROM Employee WHERE manager_nr = ´U000001´;,,,1,
389,389,firstname389,lastname389,1,,,,1e,,,,,,SELECT A.name FROM Artist A WHERE A.death_date IS NULL;,,,1,
389,389,firstname389,lastname389,1,,,,1f,,,,,,SELECT DISTINCT P.artist_id  FROM Performs P WHERE P.role = ´guitarist´,,,1,
389,389,firstname389,lastname389,1,,,,1g,,,,,,SELECT R.album_id  FROM Release R  WHERE R.country = ´Belgium´,,,1,
389,389,firstname389,lastname389,1,,,,1h,,,,,,"SELECT T.song FROM Track T, Album A WHERE T.album_id = A.album_id AND A.title = ´Nevermind´",,,1,
389,389,firstname389,lastname389,1,,,,1i,,,,,,SELECT A.title FROM Album A JOIN Release R ON R.album_id = A.album_id WHERE R.country <> ´Belgium´,,,1,
389,389,firstname389,lastname389,1,,,,1j,,,,,,"SELECT Album.title, SUM(Album.duration) AS total_duration FROM Album ",,,1,
389,389,firstname389,lastname389,1,,,,1k,,,,,,"SELECT A.name, COUNT(P.track_id) AS activity FROM Artist A, Performs P WHERE (3 <= (     SELECT COUNT(*)      FROM P     WHERE P.role = ´vocals´ AND A.artist_id = P.artist_id)) GROUP BY A.name  ORDER BY DESC(activity)",,,1,
389,389,firstname389,lastname389,1,,,,6d,,,,,,,,,1,
390,390,firstname390,lastname390,1,,,,1e,,,,,,SELECT name FROM Artist WHERE death_date IS NULL;,,,1,
390,390,firstname390,lastname390,1,,,,1f,,,,,,SELECT DISTINCT artist_id FROM Performs WHERE role = ´guitarist´;,,,1,
390,390,firstname390,lastname390,1,,,,1g,,,,,,SELECT album_id FROM Release WHERE country = ´Belgium´;,,,1,
390,390,firstname390,lastname390,1,,,,1h,,,,,,SELECT t.song FROM Track t JOIN Album a ON a.album_id = t.album_id WHERE a.title = ´Nevermind´;,,,1,
390,390,firstname390,lastname390,1,,,,1i,,,,,,SELECT DISTINCT a.title FROM Album a JOIN Release r ON r.album_id = a.album_id WHERE country <> ´´;,,,1,
390,390,firstname390,lastname390,1,,,,1j,,,,,,"SELECT a.title, SUM(t.duration) AS total_duration FROM Album a JOIN Track t ON t.album_id = a.album_id   .;",,,1,
390,390,firstname390,lastname390,1,,,,1k,,,,,,"SELECT a.name, COUNT(p.track_id) AS number_of_tracks FROM Artist a JOIN Performs p ON p.artist_id  .  .  ´´   .        ;",,,1,
390,390,firstname390,lastname390,1,,,,6d,,,,,,WITH RECURSIVE ManagedBy(employee_nr) AS (SELECT employee_nr FROM Employee WHERE employee_nr = ´U000001´   .        .  .     ;,,,1,
391,391,firstname391,lastname391,1,,,,1e,,,,,,SELECT name  FROM Artist  WHERE death_date IS NULL;,,,1,
391,391,firstname391,lastname391,1,,,,1f,,,,,,SELECT DISTINCT artist_id FROM Performs WHERE role = 'guitarist' ;,,,1,
391,391,firstname391,lastname391,1,,,,1g,,,,,,SELECT album_id  FROM Release WHERE country = 'Belgium';,,,1,
391,391,firstname391,lastname391,1,,,,1h,,,,,,"SELECT T.song FROM Track T, Album A WHERE A.album_id = T.album_id AND A.title ='Nevermind';",,,1,
391,391,firstname391,lastname391,1,,,,1i,,,,,,"SELECT A.title FROM Album A, Realease R WHERE A.album_id =R.album_id     AND R.country <> 'Belgium';",,,1,
391,391,firstname391,lastname391,1,,,,1j,,,,,,"SELECT A.title, SUM(T.duration) AS total_duration FROM Album A, Track T, WHERE 'A.album_id =T.album_id;",,,1,
391,391,firstname391,lastname391,1,,,,1k,,,,,,"SELECT A.name, COUNT(P.artist_id) AS total_vocals FROM Artist A, Performs P WHERE A.artist_id=P.artist_id AND P.role = 'vocals'  AND total_vocals>2;",,,1,
391,391,firstname391,lastname391,1,,,,6d,,,,,,"WITH RECURSIVE Management(employee_nr) AS(     SELECT E.manager_nr AS manager     FROM Employee E     WHERE manager_nr='U000001', UNION      SELECT E.manager_nr as manager     FROM Management M, Employee E     WHERE M.manager = E.manager     AND NOT E.manager IS NULL) SELECT * FROM Management;",,,1,
392,392,firstname392,lastname392,1,,,,1e,,,,,,SELECT name FROM Artist WHERE death_date IS NULL;,,,1,
392,392,firstname392,lastname392,1,,,,1f,,,,,,SELECT DISTINCT artist_id FROM Performs WHERE role='guitarist';,,,1,
392,392,firstname392,lastname392,1,,,,1g,,,,,,SELECT album_id FROM Release WHERE country='Belgium';,,,1,
392,392,firstname392,lastname392,1,,,,1h,,,,,,"SELECT T.song FROM Track T, Album A WHERE T.album_id=A.album_id AND A.title='Nevermind';",,,1,
392,392,firstname392,lastname392,1,,,,1i,,,,,,SELECT A.title FROM Album A WHERE NOT A.album_id IN (     SELECT album_id FROM Release WHERE country='Belgium'  );,,,1,
392,392,firstname392,lastname392,1,,,,1j,,,,,,"SELECT A.title, SUM(T.duration) FROM Track T, Album A  WHERE T.album_id=A.album_id GROUP BY A.title; -- Adds the durations of 2 albums with the same name together, but whatever",,,1,
392,392,firstname392,lastname392,1,,,,1k,,,,,,"SELECT A.name, COUNT(*) FROM Artist A, Performs P  WHERE A.artist_id=P.artist_id AND P.role='vocals' GROUP BY A.name HAVING COUNT(*)>2 ORDER BY COUNT(*) DESC;",,,1,
392,392,firstname392,lastname392,1,,,,6d,,,,,,"WITH RECURSIVE Managed(nr) AS (     SELECT 'U000001'     UNION     SELECT E.employee_nr FROM Managed M, Employee E      WHERE NOT E.manager_nr IS NULL AND E.manager_nr=M.employee_nr ) SELECT * FROM Managed;",,,1,
393,393,firstname393,lastname393,1,,,,1e,,,,,,SELECT name FROM Artist WHERE death_date IS NULL;,,,1,
393,393,firstname393,lastname393,1,,,,1f,,,,,,SELECT DISTINCT artist_id FROM Performs WHERE role = 'guitarist';,,,1,
393,393,firstname393,lastname393,1,,,,1g,,,,,,SELECT album_id FROM Release WHERE country = 'Belgium';,,,1,
393,393,firstname393,lastname393,1,,,,1h,,,,,,"SELECT Track.song FROM Track, Album WHERE Track.album_id = Album.album_id AND Album.title = 'Nevermind';",,,1,
393,393,firstname393,lastname393,1,,,,1i,,,,,,SELECT title FROM Album WHERE album_id NOT IN ( SELECT album_id FROM Release WHERE country = 'Belgium' );,,,1,
393,393,firstname393,lastname393,1,,,,1j,,,,,,"SELECT Album.title, SUM(Track.duration) FROM Album, Track Where Album.album_id = Track.album_id Group by album_id;",,,1,
393,393,firstname393,lastname393,1,,,,1k,,,,,,"SELECT Artist.name, COUNT(Track.track_id) FROM Artist, Track, Performs WHERE Artist.artist_id = Performs.artist_id AND Track.track_id = Performs.track_id GROUP BY Artist.name HAVING COUNT(Track.track_id) >= 3 ORDER BY COUNT(Track.track_id) DESC;",,,1,
393,393,firstname393,lastname393,1,,,,6d,,,,,,"WITH RECURSIVE Managed(id) AS( SELECT E.manager_nr AS id FROM Employee E WHERE E.employee_id = 'U000001' UNION SELECT E.manager_nr AS id FROM Managed M, Employee E WHERE M.id = E.id AND NOT E.employee_nr IS NULL ); SELECT employee_numbers FROM Managed",,,1,
394,394,firstname394,lastname394,1,,,,1e,,,,,,SELECT name FROM Artist WHERE death_date IS NULL;,,,1,
394,394,firstname394,lastname394,1,,,,1f,,,,,,SELECT P.artist_id FROM Performs P WHERE P.role = 'guitarist';,,,1,
394,394,firstname394,lastname394,1,,,,1g,,,,,,SELECT album_id FROM Release WHERE country = 'Belgium';,,,1,
394,394,firstname394,lastname394,1,,,,1h,,,,,,"SELECT T.song FROM Track T, Album A WHERE A.title='Nevermind' AND T.album_id = A.album_id;",,,1,
394,394,firstname394,lastname394,1,,,,1i,,,,,,SELECT title FROM Album WHERE NOT album_id IN ( SELECT R.album_id  FROM Release R WHERE R.country = 'Belgium' );,,,1,
394,394,firstname394,lastname394,1,,,,1j,,,,,,"SELECT A.title, SUM(T.duration) FROM Album A, Track T WHERE A.album_id = T.album_id  GROUP BY A.title;",,,1,
394,394,firstname394,lastname394,1,,,,1k,,,,,,"SELECT A.name, COUNT(*) FROM Artist A, Performs P WHERE A.artist_id = P.artist AND P.role = 'vocals' GROUP BY A.name HAVING COUNT(*) >=3 ORDER BY COUNT(*) DESC;",,,1,
394,394,firstname394,lastname394,1,,,,6d,,,,,,"WITH RECURSIVE Employees (code) AS( SELECT employee_nr AS code1,name,job_description, manager_nr FROM Employee WHERE manager_nr = code UNION  SELECT DISTINCT employee_nr,name,job_description, manager_nr FROM Employee WHERE manager_number IN Employees(code1) ) SELECT employee_nr FROM Employees('U000001');",,,1,
395,395,firstname395,lastname395,1,,,,1e,,,,,,SELECT name FROM Artist WHERE death_date IS NOT NULL;,,,1,
395,395,firstname395,lastname395,1,,,,1f,,,,,,"SELECT DISTINCT Artist.artist_id FROM Artist, Performs WHERE Artist.artist_id=Performs.artist_id  .;",,,1,
395,395,firstname395,lastname395,1,,,,1g,,,,,,"SELECT album_id FROM Release WHERE country=""Belgium""; --Could be ""belgium"" i.o. ""Belgium""",,,1,
395,395,firstname395,lastname395,1,,,,1h,,,,,,"SELECT Track.song FROM Track, Album WHERE Track.album_id=Album.album_id AND Album.title=""Nevermind"";",,,1,
395,395,firstname395,lastname395,1,,,,1i,,,,,,"SELECT title FROM Album WHERE album_id NOT IN (     SELECT album_id FROM Release WHERE country=""Belgium"" );",,,1,
395,395,firstname395,lastname395,1,,,,1j,,,,,,"SELECT Album.title, SUM(Track.duration) AS ""Duration""      FROM Album, Track     WHERE Album.album_id=Track.album_id     GROUP BY Album.album_id      ORDER BY SUM(Track.duration) DESC; ",,,1,
395,395,firstname395,lastname395,1,,,,1k,,,,,,"SELECT name, COUNT(* ) FROM Artist, Performs -- ??????????????? WHERE Performs.role=""vocals""  AND Artist.artist_id=Performs.artist_id AND Artist.artist_id IN ( -- Vocals >= 3     SELECT artist_id, COUNT(*) FROM Performs GROUP BY role HAVING COUNT(*) >= 3 ) GROUP BY Performs.role ORDER BY COUNT(*) DESC;",,,1,
395,395,firstname395,lastname395,1,,,,6d,,,,,,"WITH RECURSIVE get_employees(nr) AS (     SELECT employee_nr FROM Employee WHERE employee_nr=""U000001"" --Base case is U000001     UNION     SELECT employee_nr FROM get_employees WHERE manager_nr = nr --??     -- Select nr where the managers nr is the previous nr ) SELECT * FROM get_employees;",,,1,
396,396,firstname396,lastname396,1,,,,1e,,,,,,SELECT name  FROM Artist WHERE death_date = NULL;,,,1,
396,396,firstname396,lastname396,1,,,,1f,,,,,,SELECT DISTINCT artist_id FROM Performs WHERE role = 'guitarist';,,,1,
396,396,firstname396,lastname396,1,,,,1g,,,,,,SELECT album_id FROM Release WHERE country = 'Belgium'; ,,,1,
396,396,firstname396,lastname396,1,,,,1h,,,,,,SELECT song FROM Track WHERE Album.title = 'Nevermind' JOIN Album ON Track.album_id = Album.album_id;,,,1,
396,396,firstname396,lastname396,1,,,,1i,,,,,,SELECT DISTINCT title FROM Album WHERE Release.country <> 'Belgium' JOIN Release ON Album.album_id = Release.album_id;,,,1,
396,396,firstname396,lastname396,1,,,,1j,,,,,,"SELECT Album.title, Track.song, Track.duration FROM Album, Track",,,1,
396,396,firstname396,lastname396,1,,,,1k,,,,,,SELECT Artist.name FROM Artist WHERE ( COUNT (Performs.role = 'vocals') >= 3 ) JOIN Performs ON Artist.artist_id = Performs.artist_id,,,1,
396,396,firstname396,lastname396,1,,,,6d,,,,,,"WITH RECURSIVE Manage_chain(employee_nr, manager_nr) As ( sELECT employee_nr, manager_nr FROM Employee WHERE employee_nr = 'U000001' UNION SELECT E.employee_nr, E.manager_nr FROM Manage_chain M, Employee E WHERE M.employee_nr = E.manager_nr ) SELECT * FROM Manage_chain AS Employee;",,,1,
